{
  "$schema": "https://json-schema.org/draft/2020-12/schema",
  "$id": "https://photoai.local/drafts/photo_knowledge_bundle_consumer.v1.schema.json",
  "title": "Photo Knowledge Bundle Consumer v1",
  "description": "App-local acceptance boundary for an approved, image-free Photo Knowledge Bundle. This is not a shared-contract change or a transport specification.",
  "type": "object",
  "additionalProperties": false,
  "required": ["contract_version", "bundle_id", "source", "integrity", "references"],
  "properties": {
    "contract_version": {
      "const": "1.0",
      "description": "Unknown versions are rejected rather than guessed or partially rendered."
    },
    "bundle_id": { "$ref": "#/$defs/opaqueId" },
    "source": {
      "type": "object",
      "additionalProperties": false,
      "required": ["origin", "producer_id", "release_id"],
      "properties": {
        "origin": { "enum": ["LOCAL_SERVICE", "PIPELINE"] },
        "producer_id": { "$ref": "#/$defs/opaqueId" },
        "release_id": { "$ref": "#/$defs/opaqueId" }
      }
    },
    "integrity": {
      "type": "object",
      "additionalProperties": false,
      "required": ["algorithm", "payload_sha256"],
      "properties": {
        "algorithm": { "const": "SHA-256" },
        "payload_sha256": { "type": "string", "pattern": "^[A-Fa-f0-9]{64}$" }
      }
    },
    "references": {
      "type": "array",
      "minItems": 1,
      "maxItems": 20,
      "items": {
        "type": "object",
        "additionalProperties": false,
        "required": ["reference_id", "photography"],
        "properties": {
          "reference_id": { "$ref": "#/$defs/opaqueId" },
          "photography": {
            "type": "object",
            "additionalProperties": false,
            "required": ["scene", "background_story", "lighting", "composition", "subject_intent", "emotion", "pose_template", "camera_position", "director_prompt"],
            "properties": {
              "scene": { "$ref": "#/$defs/text240" },
              "background_story": { "$ref": "#/$defs/text480" },
              "lighting": { "$ref": "#/$defs/text240" },
              "composition": { "$ref": "#/$defs/text360" },
              "subject_intent": { "$ref": "#/$defs/text360" },
              "emotion": { "$ref": "#/$defs/text240" },
              "pose_template": {
                "$ref": "#/$defs/text480",
                "description": "Textual pose intent only; never keypoints, skeleton coordinates, biometric output, or live Pose data."
              },
              "camera_position": { "$ref": "#/$defs/text360" },
              "director_prompt": { "$ref": "#/$defs/text720" }
            }
          }
        }
      }
    }
  },
  "$defs": {
    "opaqueId": {
      "type": "string",
      "minLength": 1,
      "maxLength": 128,
      "pattern": "^[A-Za-z0-9][A-Za-z0-9_-]{0,127}$",
      "description": "Opaque token syntax only: no URI, path, email, whitespace, colon, slash, or backslash syntax. Producer policy must ensure it is not derived from an account, device, location, file name, URI, EXIF record, or media hash."
    },
    "text240": { "type": "string", "minLength": 1, "maxLength": 240, "pattern": "^(?=.*\\S)[^\\r\\n]+$" },
    "text360": { "type": "string", "minLength": 1, "maxLength": 360, "pattern": "^(?=.*\\S)[^\\r\\n]+$" },
    "text480": { "type": "string", "minLength": 1, "maxLength": 480, "pattern": "^(?=.*\\S)[^\\r\\n]+$" },
    "text720": { "type": "string", "minLength": 1, "maxLength": 720, "pattern": "^(?=.*\\S)[^\\r\\n]+$" }
  }
}
